{
  "schemaVersion": 1,
  "pass": true,
  "thresholds": {
    "changedPixelRatioMax": 0.25,
    "meanAbsMax": 20,
    "rmsMax": 30
  },
  "checks": {
    "changedPixelRatio": {
      "actual": 0.175085,
      "max": 0.25,
      "pass": true
    },
    "meanAbs": {
      "actual": 6.676218,
      "max": 20.0,
      "pass": true
    },
    "rms": {
      "actual": 33.608311,
      "max": 30.0,
      "pass": false
    }
  }
}
